{
  "$schema": "https://json-schema.org/draft/2020-12/schema",
  "$id": "agenticflow/setupref/feature.schema.json",
  "title": "Feature Spec",
  "description": "A single feature, decomposed by layer. Composes the layer schemas via $ref under frontend/backend/database/contract. A repo's per-feature schema (specs/features/<f>/schema.json) extends THIS via allOf and may pin feature_id and add feature-specific constraints. The instance this validates is the feature's feature.json.",
  "type": "object",
  "required": [
    "feature_id",
    "title",
    "feature_owner",
    "business_process",
    "status",
    "layers",
    "component_ids",
    "acceptance_criteria",
    "evidence_required"
  ],
  "properties": {
    "feature_id": {
      "type": "string",
      "description": "Stable kebab-case id, e.g. 'sales-accounts'.",
      "pattern": "^[a-z0-9]+(-[a-z0-9]+)*$"
    },
    "title": { "type": "string", "minLength": 1 },
    "feature_owner": { "type": "string", "description": "The person, team, or role accountable for this feature's intent." },
    "business_process": { "type": "string", "description": "The real-world or technical process this feature serves, written in human-readable language." },
    "status": {
      "type": "string",
      "enum": ["planned", "in_progress", "built-at-parity", "gap", "not-built", "descoped", "unverified"]
    },
    "data_classification": {
      "type": "string",
      "description": "Optional per-feature override of the repo default (root.schema.json).",
      "enum": ["public", "internal", "confidential", "regulated"]
    },
    "layers": {
      "type": "array",
      "description": "Which layers this feature touches. Each listed layer SHOULD have a matching block below.",
      "minItems": 1,
      "items": { "enum": ["frontend", "backend", "database", "contract"] }
    },
    "component_ids": {
      "type": "array",
      "description": "Component IDs from components.md this feature realizes. Format <DOMAIN>-<AREA>-NNN, e.g. SALES-ACCT-001.",
      "minItems": 1,
      "items": { "type": "string", "pattern": "^[A-Z0-9]+(-[A-Z0-9]+)*-[0-9]{3}$" }
    },
    "acceptance_criteria": {
      "type": "array",
      "description": "Testable criteria. Mirrors AgenticFlow's Requirement model (REQ-id + coverage). Write these in human-readable language; coverage tells the harness HOW each is checked.",
      "minItems": 1,
      "items": {
        "type": "object",
        "required": ["id", "text", "coverage"],
        "properties": {
          "id": { "type": "string", "pattern": "^(REQ|AC)-[0-9]{3}$" },
          "text": { "type": "string", "minLength": 1 },
          "coverage": {
            "enum": ["automated_check", "manual_review", "visual_review", "security_review", "data_review", "unsupported"]
          },
          "command": { "type": "string", "description": "Deterministic command (only for automated_check)." },
          "reviewer": { "type": "string", "description": "Reviewer role (for *_review coverage)." },
          "evidence": { "type": "string", "description": "Required evidence kind (screenshot/log/etc.)." }
        }
      }
    },
    "evidence_required": {
      "type": "array",
      "description": "Evidence kinds that must be satisfied before this feature's work is 'done', e.g. 'typecheck','tests','erd-parity','endpoint-parity','e2e','screenshot'.",
      "minItems": 1,
      "items": { "type": "string" }
    },
    "contract": { "$ref": "./layers/contract.schema.json" },
    "frontend": { "$ref": "./layers/frontend.schema.json" },
    "backend": { "$ref": "./layers/backend.schema.json" },
    "database": { "$ref": "./layers/database.schema.json" },
    "open_questions": {
      "type": "array",
      "description": "Unresolved decisions blocking or shaping the feature.",
      "items": { "type": "string" }
    }
  }
}
