{
  "feature_id": "<feature-id>",
  "title": "<Feature Title>",
  "feature_owner": "<person, team, or role>",
  "business_process": "<human-readable description of the process this serves>",
  "status": "planned",
  "data_classification": "internal",
  "layers": ["contract", "database", "backend", "frontend"],
  "component_ids": ["<DOMAIN>-<AREA>-001"],
  "acceptance_criteria": [
    {
      "id": "REQ-001",
      "text": "<human-readable, testable statement of expected behavior>",
      "coverage": "automated_check",
      "command": "<deterministic command, only for automated_check>"
    },
    {
      "id": "REQ-002",
      "text": "<a criterion verified by a person>",
      "coverage": "manual_review",
      "reviewer": "<role>",
      "evidence": "<screenshot|log|review-note>"
    }
  ],
  "evidence_required": ["typecheck", "tests"],
  "contract": {
    "owner": "<role>",
    "status": "planned",
    "source": "<path to shared types module>",
    "types": ["<TypeName>"],
    "enums": []
  },
  "database": {
    "owner": "<role>",
    "status": "planned",
    "schema_module": "<db schema module>",
    "entities": [{ "name": "<table>", "columns": [{ "name": "id", "type": "uuid" }] }],
    "migrations": [],
    "erd_ref": "<path to ERD or MISSING>"
  },
  "backend": {
    "owner": "<role>",
    "status": "planned",
    "context": "<backend context path>",
    "endpoints": [{ "method": "GET", "path": "/api/<x>" }]
  },
  "frontend": {
    "owner": "<role>",
    "status": "planned",
    "module": "<frontend module path>",
    "routes": [{ "path": "/<x>", "page": "<Page>" }]
  },
  "open_questions": []
}
