{
  "feature_id": "survival-analysis",
  "title": "Survival Analysis",
  "feature_owner": "Builder 1",
  "business_process": "Run one real survival stratification on a TCGA slice and turn it into a provenance-tagged finding object the graph can accept.",
  "status": "planned",
  "data_classification": "internal",
  "layers": ["backend"],
  "component_ids": [
    "BC-ANLY-001",
    "BC-ANLY-002",
    "BC-ANLY-003",
    "BC-ANLY-004"
  ],
  "acceptance_criteria": [
    {
      "id": "REQ-001",
      "text": "The TCGA LUAD slice loads from the on-disk cache with no network call.",
      "coverage": "automated_check",
      "command": "python -m pytest tests/test_analysis.py -k cache"
    },
    {
      "id": "REQ-002",
      "text": "The high/low signature split is reproducible: the same input yields the same groups and the same n.",
      "coverage": "automated_check",
      "command": "python -m pytest tests/test_analysis.py -k split"
    },
    {
      "id": "REQ-003",
      "text": "The analysis reports HR, 95% CI, p, and n per arm, and states whether the result is univariate or stage-adjusted.",
      "coverage": "automated_check",
      "command": "python -m pytest tests/test_analysis.py -k survival"
    },
    {
      "id": "REQ-004",
      "text": "The run_analysis output is accepted by the write path without hand-editing.",
      "coverage": "automated_check",
      "command": "python -m pytest tests/test_analysis.py -k finding_object"
    },
    {
      "id": "REQ-005",
      "text": "A biologist confirms the effect size and cohort are defensible — the numbers must survive being read aloud on stage.",
      "coverage": "manual_review",
      "reviewer": "Biologist 1",
      "evidence": "review-note"
    }
  ],
  "evidence_required": ["tests"],
  "backend": {
    "owner": "Builder 1",
    "status": "planned",
    "context": "analysis",
    "endpoints": [{ "method": "POST", "path": "/mcp/tools/run_analysis" }]
  },
  "open_questions": [
    "Is the demo's headline result univariate or stage-adjusted? F-093 was abandoned because the effect collapsed under stage adjustment — see review-queue.md row 1."
  ]
}
